Company,AI_Method,Application_Area
Shiru,Neural network discovery,Plant-based protein ingredient design
NotCo,Multi-module AI for flavor pairing and formulation,Plant-based product development
Brightseed,Machine learning-based discovery,Bioactive compound identification
Perfect Day,Data-driven strain optimization,Precision fermentation for alternative dairy proteins
Journey Foods,Ingredient graph analytics,Product formulation insights
Cargill,Computer vision and robotics,Poultry processing automation
IBM Food Trust,Blockchain with AI analytics,Supply chain traceability
PathogenDx,Microarray plus machine learning,Food contamination detection
Analytical Flavor Systems (Gastrograph AI),Predictive modeling of sensory profiles,Flavor optimization
Climax Foods,Machine learning-driven formulation,Plant-based cheese development
